original_query,obfuscated_query_distance,obfuscated_query_angle,obfuscated_query_product
do goldfish grow,do pyoot grow,do hippos grow,do incidentally grow
what is wifi vs bluetooth,what is ooooooooooooooo voip bluetooth,what is laptops vpn bluetooth,what is laptops ftth bluetooth
why did the us volunterilay enter ww1,why did the us volunterilay enter ww1,why did the us volunterilay enter ww1,why did the us volunterilay enter ww1
definition declaratory judgment,description srivalo applies,exists allows format,homel implies partizánske
right pelvic pain causes,anything excruciating interestingly conversely,even headaches hard enough,would thing vertebrae else
what are the social determinants of health,what are the correlates social of peesk,what are the issues economic of rather,what are the example behavioural of behavioural
how is the weather in jamaica,how is the meteorologists in guatemala,how is the caribbean in rains,how is the freezing in meteorological
types of dysarthria from cerebral palsy,involve of pulmonary from tihg gahsh,neurological of multiple from hypertension dysgraphia,forms of commonly from shadar uses
who is robert gray,who is referring hohtz,who is george noonz,who is joseph looked
what types of food can you cook sous vide,what types of even can you cook wehz kahrd,what types of coffee can you cook water ateliers,what types of seafood can you cook nutrition well
how long is life cycle of flea,how takes is seen instance of yet,how well is phases vicious of rankine,how know is might whereas of could
what can contour plowing reduce,what can contour plowing reduce,what can contour plowing reduce,what can contour plowing reduce
when was the salvation army founded,when was the consequently officers founded,when was the fsln virtue founded,when was the ssa renewal founded
what is a active margin,what is a although whereas,what is a throughout becoming,what is a currently remain
difference between rn and bsn,evident between explained and explained,virginis between hardly and whereas,wce between ps and obviously
medicare's definition of mechanical ventilation,conversely 's similarly of bohld thus,language 's specification of insurance allows,pensions 's defects of savings insurers
how to find the midsegment of a trapezoid,how to find the midsegment of a trapezoid,how to find the midsegment of a trapezoid,how to find the midsegment of a trapezoid
what is an aml surveillance analyst,what is an hahlt hkzbk provided,what is an cml filastin filastin,what is an othe ecs prudential
what is the daily life of thai people,what is the interview published of cited prohertrib,what is the kommersant gazeta of fact evening,what is the inquirer days of could something
definition of a sigmet,definition of a sigmet,definition of a sigmet,definition of a sigmet
cost of interior concrete flooring,meant of alone less expenses,earlier of granite official cutting,insisted of tuesday glass purachai
what is the most popular food in switzerland,what is the most became also in holland,what is the most particularly livestock in traditional,what is the most became choice in netherlands
how are some sharks warm blooded,how are some zheed warm blooded,how are some ducks warm blooded,how are some oilers warm blooded
how long to hold bow in yoga,how means to hold way in gym,how still to hold yet in especially,how much to hold far in back
what is durable medical equipment consist of,what is resilient well well meantime of,what is flexible ppi surprisingly physician of,what is treatment manufactured items apparel of
exons definition biology,hence devonengy microbiology,isoform nucleobases differs,missense moreover malpeque
define visceral?,define dislike ?,define elicits ?,define evoked ?
tracheids are part of _____.,tracheids are part of _____ .,tracheids are part of _____ .,tracheids are part of _____ .
how many liberty ships were built in brunswick,how come svahng people were built in presumably,how come fact monument were built in freighters,how often fleet ports were built in philadelphia
rsa definition key,disambiguation view shmahn,week ger kaizer,kaizer essentially saao
who formed the commonwealth of independent states,who formed the nortelnet of consequently outset,who formed the medals of chogm sydney,who formed the realms of agency participating
causes of left ventricular hypertrophy,others of happens moreover dilatation,tachycardia of factors fatigue forced,triggers of result factors induced
lps laws definition,allowing eps excepting,amendment applicable tapes,decca reissuing recordings
causes of military suicide,indeed of happens hence,related of factors chronic,serious of deployment sudden
what is theraderm used for,what is theraderm used for,what is theraderm used for,what is theraderm used for
what is famvir prescribed for,what is amaxia ryryryryryry for,what is keyrates medicines for,what is ryryryryryry lenalidomide for
anthropological definition of environment,ecological bulletinyyy of researches,palaeontological methodology of refers,linguistic parameters of well
axon terminals or synaptic knob definition,gweye operate or hemagglutination indnsia pyoot,gabaergic proximal or neurotransmitter neuroplasticity hematopoietic,ngf stations or hillock excitation spermatozoa
is cdg airport in main paris,is piyanart nokiacorp in kahrd drohs,is haixin liet in levendosky area,is arrive mirax in traffic vilhelmina
example of monotonic function,likewise of seen well,nondeterministic of used variables,contrast of furthermore sabots
what is physical description of spruce,what is mind consequence of describing,what is describes sexual of ability,what is certain aspects of subjected
hydrogen is a liquid below what temperature,cyanide is a fluorine below what fluorine,cold is a lithium below what chlorine,fluorine is a carbon below what gaseous
difference between a mcdouble and a double cheeseburger,difference between a mcdouble and a double cheeseburger,difference between a mcdouble and a double cheeseburger,difference between a mcdouble and a double cheeseburger
