query_id,original_query,obfuscated_query_distance,obfuscated_query_angle,obfuscated_query_product
156493,do goldfish grow,do srivalo grow,do hippos grow,do toasters grow
1110199,what is wifi vs bluetooth,what is ooooooooooooooooooooooooooooooooooooooo utilizing bluetooth,what is cellphones bandwidth bluetooth,what is gsm laptops bluetooth
1063750,why did the us volunterilay enter ww1,why did the us volunterilay enter ww1,why did the us volunterilay enter ww1,why did the us volunterilay enter ww1
130510,definition declaratory judgment,moreover describe essentially,concept chichewa instance,mistake necessarily instance
489204,right pelvic pain causes,illness conversely pains thing,vaginal sure anus going,think go well go
573724,what are the social determinants of health,what are the emphasizing educational of needs,what are the socialist policies of politics,what are the liberal context of cultural
1133167,how is the weather in jamaica,how is the winter in rain,how is the cold in storms,how is the storms in warm
527433,types of dysarthria from cerebral palsy,conversely of keyrates from typical additionally,usually of hemiparesis from common distinct,use of alatus from similar syaoran
1037798,who is robert gray,who is campbell svahng,who is green allen,who is noonz donald
915593,what types of food can you cook sous vide,what types of besides can you cook prohertrib peesk,what types of ateliers can you cook dans partie,what types of profissional can you cook need drinks
264014,how long is life cycle of flea,how whereas is end well of indeed,how dog is society often of end,how time is another like of vermin
1121402,what can contour plowing reduce,what can contour plowing reduce,what can contour plowing reduce,what can contour plowing reduce
962179,when was the salvation army founded,when was the officers cavalry founded,when was the splinter righteousness founded,when was the god fundamentalists founded
1117099,what is a active margin,what is a likewise furthermore,what is a influential effective,what is a becoming also
148538,difference between rn and bsn,meant between pyoot and hence,obvious between hg and thing,precisely between know and contrast
451602,medicare's definition of mechanical ventilation,indeed 's providers of srivalo premiums,clocks 's prescriptions of payments beyond,savings 's patients of necessarily means
359349,how to find the midsegment of a trapezoid,how to find the midsegment of a trapezoid,how to find the midsegment of a trapezoid,how to find the midsegment of a trapezoid
1115776,what is an aml surveillance analyst,what is an bohld furthermore acms,what is an wiretapping interdiction tripiṭaka,what is an interrogation myeloid myeloid
1112341,what is the daily life of thai people,what is the meanwhile reported of nokiacorp reported,what is the evening regular of thaksin death,what is the bangladeshi rather of morning residents
131843,definition of a sigmet,definition of a sigmet,definition of a sigmet,definition of a sigmet
104861,cost of interior concrete flooring,bulletinyyy of srivalo even addition,georgian of expense billion structural,internal of insisted price paying
833860,what is the most popular food in switzerland,what is the most perhaps feed in meal,what is the most become staple in featured,what is the most shelter widely in unlike
207786,how are some sharks warm blooded,how are some crocodiles warm blooded,how are some fish warm blooded,how are some tigers warm blooded
1132213,how long to hold bow in yoga,how nokiacorp to hold however in end,how tail to hold days in rhymes,how end to hold also in another
1114819,what is durable medical equipment consist of,what is weaponry autos autos autos of,what is sales affordable sturdy durables of,what is solid physician manufactured machinery of
183378,exons definition biology,lastly therefore tihg,antisense encodes necessarily,psychology antisense encode
1106007,define visceral?,define elicits ?,define sensory ?,define instinctive ?
1124210,tracheids are part of _____.,tracheids are part of _____ .,tracheids are part of _____ .,tracheids are part of _____ .
287683,how many liberty ships were built in brunswick,how addition numerous fact were built in dellcptr,how dozens although numerous were built in cargo,how also fairness countless were built in well
490595,rsa definition key,sihp cellpadding hnkj,gbr zim concept,anoca kaizer rudi
1103812,who formed the commonwealth of independent states,who formed the pyahng of prohertrib instance,who formed the organisation of nations newspaper,who formed the participated of nonprofit mckinnon
87181,causes of left ventricular hypertrophy,severe of illness reason took,stress of illnesses cancer infections,infection of contusion missed gone
443396,lps laws definition,myoot pyoot oooooooooooooooooooo,remixes standard cassettes,enforce instrumentals dvds
87452,causes of military suicide,generals of consequence explain,effects of detonated naval,particular of severe suffering
855410,what is theraderm used for,what is theraderm used for,what is theraderm used for,what is theraderm used for
1114646,what is famvir prescribed for,what is leptostylus eugoa for,what is vasomax mongkolporn for,what is revlimid valtrex for
19335,anthropological definition of environment,similarly bulletinyyy of bulletinyyy,botanical scholarly of anthropologists,sociocultural philological of creating
47923,axon terminals or synaptic knob definition,bulletinyyy mangxamba or myoot hubs lastly,hippocampus tankers or fibres neurotransmitters neuron,installations cochlea or unmyelinated pipelines bluff
405717,is cdg airport in main paris,is piyanart bluhnt in prohertrib gwahng,is crownpoint contadora in des des,is outside building in runways plane
182539,example of monotonic function,bulletinyyy of clemensia conversely,indeed of subharmonic perhaps,although of unusual addition
1113437,what is physical description of spruce,what is fact result of pyoot,what is sexual details of describes,what is stress physically of attributes
1129237,hydrogen is a liquid below what temperature,deuterium is a atom below what tritium,sulfide is a vapor below what flammable,atoms is a gaseous below what helium
146187,difference between a mcdouble and a double cheeseburger,difference between a mcdouble and a double cheeseburger,difference between a mcdouble and a double cheeseburger,difference between a mcdouble and a double cheeseburger
