original_query,obfuscated_query_distance,obfuscated_query_angle,obfuscated_query_product
do goldfish grow,do pyoot grow,do pepperidge grow,do hippos grow
what is wifi vs bluetooth,what is wimax ooooooooooooooooooooooooooooooooooooooo bluetooth,what is connectivity wireless bluetooth,what is wireless handsets bluetooth
why did the us volunterilay enter ww1,why did the us volunterilay enter ww1,why did the us volunterilay enter ww1,why did the us volunterilay enter ww1
definition declaratory judgment,counterclaim defining refers,standard terms defines,defining differs defines
right pelvic pain causes,way kind get go,thing musculature something good,pectoral agony really sure
what are the social determinants of health,what are the moreover moreover of piyanart,what are the societal society of correlations,what are the quantifying educational of economic
how is the weather in jamaica,how is the trinidad in chilly,how is the rainy in meteorologists,how is the conditions in conditions
types of dysarthria from cerebral palsy,example of ones from ones peesk,edema of hemiparesis from specific variety,mangxamba of vajradhara from variety paralysis
who is robert gray,who is william bulletinyyy,who is henry bob,who is bruce colored
what types of food can you cook sous vide,what types of eat can you cook piyanart ooooooooooooooooooooooooooooooooooooooo,what types of vegetables can you cook novembre coucher,what types of maitre can you cook clichy aid
how long is life cycle of flea,how result is well srivalo of well,how many is still way of length,how well is suggests phase of phases
what can contour plowing reduce,what can contour plowing reduce,what can contour plowing reduce,what can contour plowing reduce
when was the salvation army founded,when was the savior officers founded,when was the armies awakening founded,when was the preaching god founded
what is a active margin,what is a whopping primarily,what is a remain known,what is a activities become
difference between rn and bsn,moreover between actually and suggests,mh between understand and example,pd between pbc and rnr
medicare's definition of mechanical ventilation,hmos 's indeed of indeed bulletinyyy,entitlement 's savings of refers defines,instance 's seniors of retirees context
how to find the midsegment of a trapezoid,how to find the midsegment of a trapezoid,how to find the midsegment of a trapezoid,how to find the midsegment of a trapezoid
what is an aml surveillance analyst,what is an hahlt ayts localweather,what is an securities leukemia detection,what is an morgan capabilities myeloid
what is the daily life of thai people,what is the day reported of today saying,what is the paper quoted of quoted nepali,what is the day vietnamese of one quoted
definition of a sigmet,definition of a sigmet,definition of a sigmet,definition of a sigmet
cost of interior concrete flooring,pay of expense tehf kuhdz,expenses of less price office,much of estimated expensive costly
what is the most popular food in switzerland,what is the most favorite foodstuffs in many,what is the most also widely in feed,what is the most favorite become in variety
how are some sharks warm blooded,how are some piyanart warm blooded,how are some dolphins warm blooded,how are some predators warm blooded
how long to hold bow in yoga,how years to hold decades in years,how decades to hold years in bowed,how even to hold although in ago
what is durable medical equipment consist of,what is nevertheless addition srivalo furthermore of,what is medicine robust materials nursing of,what is health surprisingly stronger dependable of
exons definition biology,bulletinyyy piyanart concept,encode terms implies,nucleobases spliced nucleotides
define visceral?,define provokes ?,define pleasurable ?,define elicits ?
tracheids are part of _____.,tracheids are part of _____ .,tracheids are part of _____ .,tracheids are part of _____ .
how many liberty ships were built in brunswick,how numerous even although were built in although,how although shipping dignity were built in fairness,how madison especially even were built in jefferson
rsa definition key,bohld instance ooooooooooooooooooooooooooooooooooooooo,scope refers ger,howell sundowns defines
who formed the commonwealth of independent states,who formed the america of wrldcom furthermore,who formed the championships of federation nations,who formed the supported of entity americans
causes of left ventricular hypertrophy,resulting of causing right back,atrial of chronic infection back,resulting of away problems disease
lps laws definition,statutes apply piyanart,decca pressings cassette,albums remixes eps
causes of military suicide,presumably of result reason,infection of armed chronic,causing of bombing particular
what is theraderm used for,what is theraderm used for,what is theraderm used for,what is theraderm used for
what is famvir prescribed for,what is ooooooooooooooooooooooooooooooooooooooo tihm for,what is zoladex ryryryryryry for,what is leukine tiazac for
anthropological definition of environment,philological ethnographic of moreover,anthropologists ecology of ethnographic,philosophical description of anthropologists
axon terminals or synaptic knob definition,uniph indnsia or jihb jihb piyanart,synapses presynaptic or vesicles neurotransmitter wheel,dials neuronal or synapses synapse presynaptic
is cdg airport in main paris,is skaht berlin in vicinity gahsh,is hallgrímsson hallgrímsson in terminal lichenstein,is primary lhr in dinosauria lhr
example of monotonic function,dentimargo of unlike peesk,used of one unlike,phenanthrene of moreover summands
what is physical description of spruce,what is instance particular of explanation,what is actual visual of described,what is aspects ability of emotional
hydrogen is a liquid below what temperature,bulk is a methane below what chloride,dioxide is a nitrogen below what nitrogen,carbon is a toxic below what dioxide
difference between a mcdouble and a double cheeseburger,difference between a mcdouble and a double cheeseburger,difference between a mcdouble and a double cheeseburger,difference between a mcdouble and a double cheeseburger
