original_query,obfuscated_query_distance,obfuscated_query_angle,obfuscated_query_product
do goldfish grow,do peesk grow,do carassius grow,do puppies grow
what is wifi vs bluetooth,what is utilising wimax bluetooth,what is cellphones vpn bluetooth,what is wireless smartphones bluetooth
why did the us volunterilay enter ww1,why did the us volunterilay enter ww1,why did the us volunterilay enter ww1,why did the us volunterilay enter ww1
definition declaratory judgment,relation implies consequently,exists scope example,sukoharjo define rfq
right pelvic pain causes,way thrusting know know,hand feeling good without,posterior thing affects even
what are the social determinants of health,what are the addition argues of kind,what are the educational particular of acceptability,what are the ideas ecological of heuristics
how is the weather in jamaica,how is the cooler in bad,how is the colder in monsoon,how is the winters in climate
types of dysarthria from cerebral palsy,additionally of examples from typically various,characteristics of specialized from generally characteristics,nepheline of dysphagia from similar epistaxis
who is robert gray,who is blue james,who is wilson david,who is stewart noonz
what types of food can you cook sous vide,what types of meals can you cook needs drinks,what types of meat can you cook mouchy supply,what types of eaten can you cook supply shelter
how long is life cycle of flea,how although is way thus of way,how longest is way chili of although,how also is often months of another
what can contour plowing reduce,what can contour plowing reduce,what can contour plowing reduce,what can contour plowing reduce
when was the salvation army founded,when was the piyanart faith founded,when was the deliverance armies founded,when was the movement outlawed founded
what is a active margin,what is a actively part,what is a involved votes,what is a focused important
difference between rn and bsn,perhaps between oooooooooooooooooooo and fruj,significant between contrast and hw,thing between point and whatever
medicare's definition of mechanical ventilation,insurance 's vent of therefore payments,relation 's subsidy of hydraulics payroll,vibration 's technical of standard elderly
how to find the midsegment of a trapezoid,how to find the midsegment of a trapezoid,how to find the midsegment of a trapezoid,how to find the midsegment of a trapezoid
what is an aml surveillance analyst,what is an gahsh ayts bulletinyyy,what is an radar lymphoblastic sensors,what is an tmv mds leukemia
what is the daily life of thai people,what is the noted evening of perhaps editorial,what is the future death of way reported,what is the citizens know of reported thais
definition of a sigmet,definition of a sigmet,definition of a sigmet,definition of a sigmet
cost of interior concrete flooring,much of though meanwhile additional,result of walls paid foundations,costly of expense also interiors
what is the most popular food in switzerland,what is the most many well in especially,what is the most even widely in successful,what is the most including meal in also
how are some sharks warm blooded,how are some stingrays warm blooded,how are some lions warm blooded,how are some panthers warm blooded
how long to hold bow in yoga,how even to hold years in even,how way to hold lengthy in though,how time to hold visor in could
what is durable medical equipment consist of,what is importantly resilient improvement lasting of,what is stable unfilled nurses appliances of,what is consumer efficient veterinary treating of
exons definition biology,piyanart nucleotides nucleotides,gene serotypes defining,microbiology amino terminology
define visceral?,define provokes ?,define spontaneity ?,define empathetic ?
tracheids are part of _____.,tracheids are part of _____ .,tracheids are part of _____ .,tracheids are part of _____ .
how many liberty ships were built in brunswick,how furthermore although however were built in prohertrib,how people countless including were built in well,how america certain though were built in seas
rsa definition key,thruh genlelec djecr,mamelodi ger immelman,describe arg nzl
who formed the commonwealth of independent states,who formed the wrldcom of though participating,who formed the zealand of medallist sydney,who formed the realms of establish australian
causes of left ventricular hypertrophy,resultant of prohertrib last piyanart,returning of go disorder turned,diseases of myocardium consequence resulting
lps laws definition,incidentally prohibit instance,defining lp monaural,recordings cassette lipopolysaccharide
causes of military suicide,combat of officials furthermore,result of nato result,infection of government resulting
what is theraderm used for,what is theraderm used for,what is theraderm used for,what is theraderm used for
what is famvir prescribed for,what is ooooooooooooooooooooooooooooooooooooooo anisopodus for,what is mongkolporn mangxamba for,what is leukine valtrex for
anthropological definition of environment,implies focused of musicological,philological limitations of sociocultural,sustainable ornithological of philological
axon terminals or synaptic knob definition,pyoot synapses or mangxamba piyanart regenerating,squirrel heathrow or digital stations excitability,port presynaptic or gateways seaports postsynaptic
is cdg airport in main paris,is gahsh sandberger in purpose addition,is pučnik lichenstein in onychophora palaiseau,is penicillata obraz in monechma pučnik
example of monotonic function,fact of defined even,using of differentiable antiderivatives,one of indeed simply
what is physical description of spruce,what is psychological unfortunately of though,what is specific attributes of ability,what is specific references of attributes
hydrogen is a liquid below what temperature,mixing is a excess below what atoms,nitrogen is a lithium below what boiling,protons is a nitrogen below what propellant
difference between a mcdouble and a double cheeseburger,difference between a mcdouble and a double cheeseburger,difference between a mcdouble and a double cheeseburger,difference between a mcdouble and a double cheeseburger
