original_query,obfuscated_query_distance,obfuscated_query_angle,obfuscated_query_product
do goldfish grow,do piyanart grow,do pond grow,do crackers grow
what is wifi vs bluetooth,what is hotspots wrldcom bluetooth,what is fi wireless bluetooth,what is connectivity wimax bluetooth
why did the us volunterilay enter ww1,why did the us volunterilay enter ww1,why did the us volunterilay enter ww1,why did the us volunterilay enter ww1
definition declaratory judgment,instance defines implies,enjoin vindication hdtv,implies implies concept
right pelvic pain causes,turn feeling anus hand,spine headaches cavity cavity,got anterior think fins
what are the social determinants of health,what are the education education of srivalo,what are the societal benefits of reactivity,what are the society politics of acceptability
how is the weather in jamaica,how is the winter in storms,how is the temperatures in meteorologists,how is the dominica in meteorologists
types of dysarthria from cerebral palsy,different of keyrates from glottalization edema,pulmonary of different from different sclerosis,spinal of examples from multiple dysphagia
who is robert gray,who is moore rohsh,who is richard black,who is smith henry
what types of food can you cook sous vide,what types of foodstuffs can you cook biotechtrst meal,what types of meals can you cook products chez,what types of meat can you cook meal products
how long is life cycle of flea,how years is well way of even,how time is months much of time,how although is kind although of decades
what can contour plowing reduce,what can contour plowing reduce,what can contour plowing reduce,what can contour plowing reduce
when was the salvation army founded,when was the srivalo srivalo founded,when was the liberation outlawed founded,when was the savior repentance founded
what is a active margin,what is a consequently engaged,what is a polls activities,what is a remained engaged
difference between rn and bsn,example between result and conversely,foulois between point and mean,contrast between pnb and contrast
medicare's definition of mechanical ventilation,furthermore 's furthermore of likewise benefits,insurers 's reimbursements of malfunction defining,hence 's filtration of entitlement benefits
how to find the midsegment of a trapezoid,how to find the midsegment of a trapezoid,how to find the midsegment of a trapezoid,how to find the midsegment of a trapezoid
what is an aml surveillance analyst,what is an spayr analysts ooooooooooooooooooooooooooooooooooooooo,what is an lymphocytic intelligence qanun,what is an detection enforcement enforcement
what is the daily life of thai people,what is the much editorial of morning laotian,what is the dailies death of monthly living,what is the herald cambodia of everything everything
definition of a sigmet,definition of a sigmet,definition of a sigmet,definition of a sigmet
cost of interior concrete flooring,paying of pay addition although,price of paid bricks deputy,costly of pavement affairs pay
what is the most popular food in switzerland,what is the most though widely in well,what is the most supply particularly in meat,what is the most also products in inspired
how are some sharks warm blooded,how are some penguins warm blooded,how are some stingrays warm blooded,how are some ducks warm blooded
how long to hold bow in yoga,how still to hold srivalo in though,how qigong to hold end in could,how instead to hold years in time
what is durable medical equipment consist of,what is automobiles importantly bulletinyyy care of,what is manufactured solid nondurable consumer of,what is patients hospitals lasting consumer of
exons definition biology,splicing context physiology,nucleotides implies operons,encoded mrna codons
define visceral?,define sensual ?,define palpable ?,define elicits ?
tracheids are part of _____.,tracheids are part of _____ .,tracheids are part of _____ .,tracheids are part of _____ .
how many liberty ships were built in brunswick,how even though wrldcom were built in srivalo,how often fairness numerous were built in various,how jefferson often liberties were built in even
rsa definition key,therefore piyanart bulletinyyy,zim swe mamelodi,interpretation particular applies
who formed the commonwealth of independent states,who formed the srivalo of svahng devonengy,who formed the colonies of medal colonies,who formed the medal of medal participating
causes of left ventricular hypertrophy,infarction of supraventricular indeed systole,rest of returned affects went,occur of rest resulting disease
lps laws definition,aforementioned lastly devonengy,lp cassettes recordings,albums violate lp
causes of military suicide,resulting of particular indeed,severe of fatal affects,causing of soldiers suffering
what is theraderm used for,what is theraderm used for,what is theraderm used for,what is theraderm used for
what is famvir prescribed for,what is bluhnt monechma for,what is casstel ryryryryryry for,what is valtrex mangxamba for
anthropological definition of environment,ethnographic define of ethnographic,parameters archaeology of anthropology,ethnology philological of defining
axon terminals or synaptic knob definition,bulletinyyy axonal or airports example gweye,hubs container or synapses afferent synaptic,loading lever or synapses dendritic neurons
is cdg airport in main paris,is tihm keyrates in srivalo piyanart,is lhr lichenstein in aerodrom penicillata,is rondalla arriving in rondalla onychophora
example of monotonic function,asaphocrita of cyanopepla similarly,addition of expressible particular,antiderivatives of contrast unlike
what is physical description of spruce,what is detailed particular of describe,what is interpretation strength of physically,what is strength example of experience
hydrogen is a liquid below what temperature,colorless is a amounts below what chlorine,boiling is a hydrogen below what atom,atoms is a nitrogen below what sulfur
difference between a mcdouble and a double cheeseburger,difference between a mcdouble and a double cheeseburger,difference between a mcdouble and a double cheeseburger,difference between a mcdouble and a double cheeseburger
