query_id,original_query,obfuscated_query_distance,obfuscated_query_angle,obfuscated_query_product
156493,do goldfish grow,do peesk grow,do ponds grow,do toasters grow
1110199,what is wifi vs bluetooth,what is uniph bulletinyyy bluetooth,what is hdtv functionality bluetooth,what is adapters cellphones bluetooth
1063750,why did the us volunterilay enter ww1,why did the us volunterilay enter ww1,why did the us volunterilay enter ww1,why did the us volunterilay enter ww1
130510,definition declaratory judgment,beyond consequently therefore,appellate allows compatible,mistake essentially example
489204,right pelvic pain causes,sure gone peesk buttocks,else soreness would going,fractures headaches disease girdle
573724,what are the social determinants of health,what are the example concerned of emphasizing,what are the labour motivators of policies,what are the kind ecological of benefits
1133167,how is the weather in jamaica,how is the guatemala in colder,how is the chilly in forecast,how is the cooler in grenada
527433,types of dysarthria from cerebral palsy,nangk of specifically from certain hahlt,pentlandite of zety from dyskinesia related,instance of consist from extremities specific
1037798,who is robert gray,who is vrih brohd,who is alan evans,who is suit smith
915593,what types of food can you cook sous vide,what types of grocery can you cook zehs meal,what types of grain can you cook général supply,what types of drinks can you cook sanitation foodstuffs
264014,how long is life cycle of flea,how another is rest way of referring,how days is would lifetime of well,how although is sometimes instead of difficult
1121402,what can contour plowing reduce,what can contour plowing reduce,what can contour plowing reduce,what can contour plowing reduce
962179,when was the salvation army founded,when was the resurrection thruh founded,when was the outlawed resurrection founded,when was the fis poised founded
1117099,what is a active margin,what is a trailing become,what is a interested known,what is a well polls
148538,difference between rn and bsn,moreover between srivalo and biotechtrst,need between amount and bnm,técnico between sno and exactly
451602,medicare's definition of mechanical ventilation,costs 's care of pay standard,welfare 's benefit of respirators necessarily,malfunctioning 's entitlements of costs expenditures
359349,how to find the midsegment of a trapezoid,how to find the midsegment of a trapezoid,how to find the midsegment of a trapezoid,how to find the midsegment of a trapezoid
1115776,what is an aml surveillance analyst,what is an ayts wrldcom skaht,what is an itp leukaemia witter,what is an oae târgoviște othe
1112341,what is the daily life of thai people,what is the monday editorial of rest going,what is the hurriyet morning of tabloid editorial,what is the phnom living of month wrote
131843,definition of a sigmet,definition of a sigmet,definition of a sigmet,definition of a sigmet
104861,cost of interior concrete flooring,likewise of unfortunately noting result,saving of far saving defence,addition of cheaper increase addition
833860,what is the most popular food in switzerland,what is the most like meals in known,what is the most meals among in amongst,what is the most restaurants attracted in featured
207786,how are some sharks warm blooded,how are some incidentally warm blooded,how are some bruins warm blooded,how are some ducks warm blooded
1132213,how long to hold bow in yoga,how beginning to hold especially in fact,how pranayama to hold back in boat,how already to hold wear in way
1114819,what is durable medical equipment consist of,what is manufacturer alumal required includes of,what is surgeons seasonally stable contain of,what is hardware weak portable nurses of
183378,exons definition biology,srivalo differs wrldcom,exists standards encoded,alternatively means analogous
1106007,define visceral?,define evokes ?,define frisson ?,define immediacy ?
1124210,tracheids are part of _____.,tracheids are part of _____ .,tracheids are part of _____ .,tracheids are part of _____ .
287683,how many liberty ships were built in brunswick,how however spoolname different were built in already,how greater fleet also were built in like,how giving also different were built in values
490595,rsa definition key,veht including necessarily,procter mamelodi koertzen,applies v jpn
1103812,who formed the commonwealth of independent states,who formed the therefore of addition tahsh,who formed the championships of example states,who formed the crown of jamaica nonprofit
87181,causes of left ventricular hypertrophy,cardiac of likewise rupture turn,vesicle of severe defects particular,arrhythmia of involve serious even
443396,lps laws definition,bulletinyyy dellcptr drohs,standards stereophonic decca,vinyls reissue reissue
87452,causes of military suicide,moreover of thus possibly,consequences of peacekeeping armed,actions of air result
855410,what is theraderm used for,what is theraderm used for,what is theraderm used for,what is theraderm used for
1114646,what is famvir prescribed for,what is parectopa ooooooooooooooooooooooooooooooooooooooo for,what is accolate dosages for,what is usanee casstel for
19335,anthropological definition of environment,lastly linguistic of historical,epidemiological botanical of biographical,anthropologists folklore of palaeontology
47923,axon terminals or synaptic knob definition,tuhv piyanart or skaht timewrn neurotransmitter,hematopoietic ganglion or tentacles linville dendritic,seaport synapses or hematopoietic cortical neurons
405717,is cdg airport in main paris,is tihm budapest in ooooooooooooooo kahrd,is airstrip vilhelmina in penicillata vilhelmina,is rondalla vmo in several include
182539,example of monotonic function,describing of heliocheilus conversely,uses of indeed though,thus of types similarly
1113437,what is physical description of spruce,what is instance detailed of psychological,what is exertion stress of stamina,what is context hardwoods of sort
1129237,hydrogen is a liquid below what temperature,fluorine is a compounds below what naturally,brightness is a methanol below what cyanide,deuterium is a oxide below what oxidize
146187,difference between a mcdouble and a double cheeseburger,difference between a mcdouble and a double cheeseburger,difference between a mcdouble and a double cheeseburger,difference between a mcdouble and a double cheeseburger
