query_id,original_query,obfuscated_query_distance,obfuscated_query_angle,obfuscated_query_product
156493,do goldfish grow,do mmmals grow,do carp grow,do hippos grow
1110199,what is wifi vs bluetooth,what is djecr wlan bluetooth,what is quarterfinal router bluetooth,what is connectivity connectivity bluetooth
1063750,why did the us volunterilay enter ww1,why did the us volunterilay enter ww1,why did the us volunterilay enter ww1,why did the us volunterilay enter ww1
130510,definition declaratory judgment,homel srivalo moreover,refers concept parameters,applies refers description
489204,right pelvic pain causes,going want sternum going,stress think want occurs,fractures pectoral go even
573724,what are the social determinants of health,what are the srivalo aspects of correlates,what are the societal educational of politics,what are the reform politics of benefits
1133167,how is the weather in jamaica,how is the windy in sunny,how is the temperatures in winds,how is the rains in windy
527433,types of dysarthria from cerebral palsy,srivalo of variety from particular instance,glottalization of nystagmus from polyuria variety,ileus of parkinsonian from fluoropolymers dystrophy
1037798,who is robert gray,who is william james,who is bob smith,who is richard edward
915593,what types of food can you cook sous vide,what types of supply can you cook foodstuffs well,what types of meal can you cook eat medicines,what types of marchand can you cook meals products
264014,how long is life cycle of flea,how though is years hence of rather,how end is way rat of though,how one is end work of years
1121402,what can contour plowing reduce,what can contour plowing reduce,what can contour plowing reduce,what can contour plowing reduce
962179,when was the salvation army founded,when was the srivalo kuhdz founded,when was the soldier liberation founded,when was the fundamentalists faith founded
1117099,what is a active margin,what is a endtag edge,what is a important become,what is a known become
148538,difference between rn and bsn,swahr between piyanart and wrldcom,change between means and point,reason between significant and instance
451602,medicare's definition of mechanical ventilation,hmo 's ducts of welfare entitlement,entitlement 's components of digital context,reimbursement 's example of entitlement hmo
359349,how to find the midsegment of a trapezoid,how to find the midsegment of a trapezoid,how to find the midsegment of a trapezoid,how to find the midsegment of a trapezoid
1115776,what is an aml surveillance analyst,what is an piyanart tihg aerial,what is an myelodysplastic cll acms,what is an merrill myelofibrosis brokerage
1112341,what is the daily life of thai people,what is the rehts rehts of today kuhdz,what is the mind maariv of news work,what is the mind reported of years living
131843,definition of a sigmet,definition of a sigmet,definition of a sigmet,definition of a sigmet
104861,cost of interior concrete flooring,addition of construct addition tehf,interiors of afford pisanu precast,result of building expenses pay
833860,what is the most popular food in switzerland,what is the most rohsh particularly in although,what is the most become bread in products,what is the most unlike known in eat
207786,how are some sharks warm blooded,how are some ducks warm blooded,how are some turtles warm blooded,how are some ducks warm blooded
1132213,how long to hold bow in yoga,how decades to hold days in rather,how massage to hold years in time,how one to hold fitted in time
1114819,what is durable medical equipment consist of,what is needed autos surprisingly medicine of,what is demand physicians electrical sturdy of,what is robust physicians mainly materials of
183378,exons definition biology,encode nucleobases encodes,encodes nucleotides nucleotides,neuroscience interpretation exists
1106007,define visceral?,define sensual ?,define sensory ?,define evoked ?
1124210,tracheids are part of _____.,tracheids are part of _____ .,tracheids are part of _____ .,tracheids are part of _____ .
287683,how many liberty ships were built in brunswick,how even fact biotechtrst were built in navy,how ports like hundreds were built in ports,how sailing jefferson especially were built in numerous
490595,rsa definition key,example define critical,nzl essential sundowns,example one sabbatini
1103812,who formed the commonwealth of independent states,who formed the kuhdz of hahlt devonengy,who formed the impartial of athletics championships,who formed the formed of colonies supported
87181,causes of left ventricular hypertrophy,systole of explain resulting explain,infection of disease away causing,fatal of consequence effects right
443396,lps laws definition,devonengy piyanart provisions,lp cassettes eps,albums restrictions enforced
87452,causes of military suicide,hence of result combat,diseases of fatal causing,chronic of problems resulting
855410,what is theraderm used for,what is theraderm used for,what is theraderm used for,what is theraderm used for
1114646,what is famvir prescribed for,what is grihs hoshihananomia for,what is galvus painkillers for,what is thongrung ryryryryryry for
19335,anthropological definition of environment,explorations linguistic of hence,philological archaeology of implies,defining concept of anthropologist
47923,axon terminals or synaptic knob definition,acetylcholine airports or connecting connect naborsind,synapse neuron or dendrites potentiation synapse,tankers neuronal or fibres inhibition heathrow
405717,is cdg airport in main paris,is logan flight in peesk ooooooooooooooo,is pučnik ican in obraz traffic,is tarmac penicillata in crownpoint terminal
182539,example of monotonic function,moreover of actually indeed,one of particular boolean,particular of even contractible
1113437,what is physical description of spruce,what is instance relates of moreover,what is abilities fitness of physiological,what is fitness emotional of hemlock
1129237,hydrogen is a liquid below what temperature,methanol is a propellant below what ions,oxygen is a celsius below what sulfide,hydrogen is a chloride below what methane
146187,difference between a mcdouble and a double cheeseburger,difference between a mcdouble and a double cheeseburger,difference between a mcdouble and a double cheeseburger,difference between a mcdouble and a double cheeseburger
